{
  "version": "1.0.0",
  "id": "TB-B-001",
  "scenario": "B",
  "revision": 1,
  "status": "NEEDS_INPUT",
  "goal": "Investigate links between AI development, energy, economics, state policy, compute infrastructure and scientific technologies; precise question pending.",
  "project": "Cross-domain research pilot",
  "scope": "personal",
  "input_refs": [
    "user-approved-project-specification",
    "pilots/pilot-profile.json"
  ],
  "output_ids": [
    "source-map",
    "claim-register",
    "support-contradiction-map",
    "expert-lenses",
    "timeline",
    "evidence-map",
    "hypothesis-cards",
    "alternative-explanations",
    "dated-forecasts",
    "unknowns",
    "next-experiments",
    "human-review-package"
  ],
  "acceptance_cases": "pilots/scenario-b/acceptance-cases.json",
  "profile_ref": "pilots/pilot-profile.json",
  "manifest_ref": "pilots/scenario-b/source-selection-manifest.json",
  "metric_policy_ref": "docs/product/METRIC_POLICY.md",
  "change_policy": "New revision and human reapproval; old evaluations invalidated.",
  "execution_authorized": false,
  "unknowns": [
    {
      "status": "NEEDS_INPUT",
      "owner": "user",
      "blocks": [
        "b.import"
      ],
      "reason": "Specific documents, Telegram channels and lawful permissions not supplied."
    },
    {
      "status": "NEEDS_INPUT",
      "owner": "user",
      "blocks": [
        "b.freeze",
        "b.analyze"
      ],
      "reason": "Pilot topic approved; exact geography, time interval, populations and causal estimand not supplied."
    },
    {
      "status": "NEEDS_INPUT",
      "owner": "user",
      "blocks": [
        "b.current-claims"
      ],
      "reason": "Numeric maximum age per source category requires approval."
    },
    {
      "status": "NEEDS_INPUT",
      "owner": "user",
      "blocks": [
        "a.execute",
        "b.experiment"
      ],
      "reason": "Approved numeric per-task amount and currency required, including local opportunity or provider costs."
    },
    {
      "status": "NEEDS_INPUT",
      "owner": "user",
      "blocks": [
        "a.benchmark",
        "b.experiment"
      ],
      "reason": "Approved numeric campaign ceiling and currency required."
    },
    {
      "status": "NEEDS_INPUT",
      "owner": "user",
      "blocks": [
        "a.execute",
        "b.experiment"
      ],
      "reason": "Approved numeric daily ceiling and currency required."
    },
    {
      "status": "NEEDS_INPUT",
      "owner": "user",
      "blocks": [
        "a.execute",
        "b.experiment"
      ],
      "reason": "Approved numeric timeout required."
    },
    {
      "status": "NEEDS_INPUT",
      "owner": "user",
      "blocks": [
        "a.independent-eval",
        "b.independent-eval"
      ],
      "reason": "Independent qualified reviewer identity and conflict-of-interest checks not supplied."
    },
    {
      "status": "NEEDS_INPUT",
      "owner": "user",
      "blocks": [
        "solution.approve",
        "research.approve"
      ],
      "reason": "Authenticated final decision owner identity not supplied."
    }
  ]
}
